{
  "header": "ORDER BELOW EXH. 4 IN CRI. MISC. APPLICATION No. 14/2019 (Kamlesh Desai etc.1 Vs. State of Maharashtra) CNR : MHST01-000164-2019",
  "background": {
    "text": "1) Present application is filed by the applicants under section 438 of Criminal Procedure Code, 1973 apprehending their arrest as a result of complaint dated 06.01.2019 filed by Rajusinh Jogsinh suspecting applicants\u0027 involvement in the offence of kidnapping, wrongful confinement, voluntarily causing hurt and extortion etc.",
    "legalReferences": [
      {
        "refNumber": 1,
        "legalActFound": {
          "actNameMatched": "Criminal Procedure Code",
          "sectionsMatched": "438",
          "stringMatched": "under section 438 of criminal procedure code",
          "legalAct": {
            "actId": 1,
            "actName": "Code of Criminal Procedure",
            "actShortNameList": "CrPC,Cr.PC,Cr. P. C.,Cr.P.C.,Criminal Procedure Code",
            "actYear": "1973",
            "minSectionNumber": "1",
            "maxSectionNumber": "484"
          }
        },
        "legalRefAcceptRejectDecision": "TBD",
        "legalRefAcceptRejectDecisionAnnotations": [
          {
            "username": "a1",
            "legalRefAcceptRejectDecision": "TBD"
          },
          {
            "username": "a2",
            "legalRefAcceptRejectDecision": "TBD"
          },
          {
            "username": "a3",
            "legalRefAcceptRejectDecision": "TBD"
          }
        ]
      }
    ]
  },
  "arguments": [
    {
      "argumentNumber": 1,
      "text": "2) Alongwith said pre­arrest bail application, the applicant has also preferred ad­interim pre­arrest bail application at Exh. 4.",
      "argumentBy": "TBD",
      "argumentByAnnotations": [
        {
          "username": "a1",
          "argumentBy": "TBD"
        },
        {
          "username": "a2",
          "argumentBy": "TBD"
        },
        {
          "username": "a3",
          "argumentBy": "TBD"
        }
      ],
      "argumentSentences": [
        {
          "sentenceNumber": 1,
          "text": "2) Alongwith said pre­arrest bail application, the applicant has also preferred ad­interim pre­arrest bail application at Exh. 4.",
          "argumentSentenceType": "TBD",
          "argumentSentenceTypeAnnotations": [
            {
              "username": "a1",
              "argumentSentenceType": "TBD"
            },
            {
              "username": "a2",
              "argumentSentenceType": "TBD"
            },
            {
              "username": "a3",
              "argumentSentenceType": "TBD"
            }
          ]
        }
      ]
    },
    {
      "argumentNumber": 2,
      "text": "3) Advocate for applicants contended that, applicant no.1 had filed Criminal case on 15.06.2018 under Sec. 420, 406 r/w 34 of I.P.C. against the present complainant as he has taken Rs.5,00,000/­ from the applicant no.1 and to avoid its repayment, he filed false case against the present applicants.",
      "argumentBy": "TBD",
      "argumentByAnnotations": [
        {
          "username": "a1",
          "argumentBy": "TBD"
        },
        {
          "username": "a2",
          "argumentBy": "TBD"
        },
        {
          "username": "a3",
          "argumentBy": "TBD"
        }
      ],
      "argumentSentences": [
        {
          "sentenceNumber": 1,
          "text": "3) Advocate for applicants contended that, applicant no.1 had filed Criminal case on 15.06.2018 under Sec. 420, 406 r/w 34 of I.P.C. against the present complainant as he has taken Rs.5,00,000/­ from the applicant no.1 and to avoid its repayment, he filed false case against the present applicants.",
          "argumentSentenceType": "TBD",
          "argumentSentenceTypeAnnotations": [
            {
              "username": "a1",
              "argumentSentenceType": "TBD"
            },
            {
              "username": "a2",
              "argumentSentenceType": "TBD"
            },
            {
              "username": "a3",
              "argumentSentenceType": "TBD"
            }
          ]
        }
      ]
    },
    {
      "argumentNumber": 3,
      "text": "4) Advocate for applicant argued that, applicants are innocent and assured that, they will neither tamper nor hamper with prosecution witnesses if they are released on anticipatory bail. It is also argued that, applicants having no connection with this alleged offence and they are falsely involved in this crime.",
      "argumentBy": "TBD",
      "argumentByAnnotations": [
        {
          "username": "a1",
          "argumentBy": "TBD"
        },
        {
          "username": "a2",
          "argumentBy": "TBD"
        },
        {
          "username": "a3",
          "argumentBy": "TBD"
        }
      ],
      "argumentSentences": [
        {
          "sentenceNumber": 1,
          "text": "4) Advocate for applicant argued that, applicants are innocent and assured that, they will neither tamper nor hamper with prosecution witnesses if they are released on anticipatory bail.",
          "argumentSentenceType": "TBD",
          "argumentSentenceTypeAnnotations": [
            {
              "username": "a1",
              "argumentSentenceType": "TBD"
            },
            {
              "username": "a2",
              "argumentSentenceType": "TBD"
            },
            {
              "username": "a3",
              "argumentSentenceType": "TBD"
            }
          ]
        },
        {
          "sentenceNumber": 2,
          "text": "It is also argued that, applicants having no connection with this alleged offence and they are falsely involved in this crime.",
          "argumentSentenceType": "TBD",
          "argumentSentenceTypeAnnotations": [
            {
              "username": "a1",
              "argumentSentenceType": "TBD"
            },
            {
              "username": "a2",
              "argumentSentenceType": "TBD"
            },
            {
              "username": "a3",
              "argumentSentenceType": "TBD"
            }
          ]
        }
      ]
    },
    {
      "argumentNumber": 4,
      "text": "5) Upon perusing FIR, hearing advocate for applicants, it appears that, applicants for the time being can be provided interim pre­arrest bail atleast till filing of say by A.P.P./I.O. Accordingly, I proceed to pass the following order.",
      "argumentBy": "TBD",
      "argumentByAnnotations": [
        {
          "username": "a1",
          "argumentBy": "TBD"
        },
        {
          "username": "a2",
          "argumentBy": "TBD"
        },
        {
          "username": "a3",
          "argumentBy": "TBD"
        }
      ],
      "argumentSentences": [
        {
          "sentenceNumber": 1,
          "text": "5) Upon perusing FIR, hearing advocate for applicants, it appears that, applicants for the time being can be provided interim pre­arrest bail atleast till filing of say by A.P.P./I.O. Accordingly, I proceed to pass the following order.",
          "argumentSentenceType": "TBD",
          "argumentSentenceTypeAnnotations": [
            {
              "username": "a1",
              "argumentSentenceType": "TBD"
            },
            {
              "username": "a2",
              "argumentSentenceType": "TBD"
            },
            {
              "username": "a3",
              "argumentSentenceType": "TBD"
            }
          ]
        }
      ]
    }
  ],
  "order": {
    "text": "ORDER 1) Application Exh. 4 is granted. 2) In the event of arrest of applicant no.1 Kamlesh Thanaramji Desai and applicant no.2 Harlal Ganpatram Sigand, they be released on interim pre­arrest bail, in respect of the complaint filed by Rajusinh Jogsinh dated 06.01.2019 on his furnishing personal bond of Rs. 25,000/­ (Rs. Twenty Fiuve Thousand), each with one or more surety/ies, till filing of say by prosecution/I.O. on following terms \u0026 conditions : a) Applicants shall attend the concern police station twice in a week preferably on every Tuesday and Friday in between 11:00 a.m. to 2.00 p.m. b) Applicants shall not directly or indirectly make any inducement, threat or promise to any person acquainted with the facts of the case so as to dissuade them from disclosing such facts to the court or to any Police Officer. c) Applicants shall make available themselves and co­ operate for interrogation by Police Officer as and when required and shall co­operate in the investigation of the present C.R. d) Applicants shall not tamper any of the documents connected to the present C.R. under investigation. e) Applicants shall also produce the documents called by the I.O. during the course of his investigation. f) Issue notice to Public Prosecutor as to why interim pre­arrest bail granted to the applicants shall not be confirmed.",
    "orderType": "TBD",
    "orderTypeAnnotations": [
      {
        "username": "a1",
        "orderType": "TBD"
      },
      {
        "username": "a2",
        "orderType": "TBD"
      },
      {
        "username": "a3",
        "orderType": "TBD"
      }
    ],
    "bondAmount": "0",
    "bondAmountAnnotations": [
      {
        "username": "a1",
        "bondAmount": "0"
      },
      {
        "username": "a2",
        "bondAmount": "0"
      },
      {
        "username": "a3",
        "bondAmount": "0"
      }
    ],
    "attendPoliceStationRecurrence": "NA",
    "attendPoliceStationRecurrenceAnnotations": [
      {
        "username": "a1",
        "attendPoliceStationRecurrence": "NA"
      },
      {
        "username": "a2",
        "attendPoliceStationRecurrence": "NA"
      },
      {
        "username": "a3",
        "attendPoliceStationRecurrence": "NA"
      }
    ],
    "attendPoliceStationFrequency": "0",
    "attendPoliceStationFrequencyAnnotations": [
      {
        "username": "a1",
        "attendPoliceStationFrequency": "0"
      },
      {
        "username": "a2",
        "attendPoliceStationFrequency": "0"
      },
      {
        "username": "a3",
        "attendPoliceStationFrequency": "0"
      }
    ]
  },
  "footer": "Notice r/o. (B.S.Wavre) Place : Satara Addl. Sessions Judge Date : 10th January, 2019 Satara",
  "annotationProcessingStage": "STAGE1",
  "annotationProcessingStageAnnotations": [
    {
      "username": "a1",
      "annotationProcessingStage": "STAGE1"
    },
    {
      "username": "a2",
      "annotationProcessingStage": "STAGE1"
    },
    {
      "username": "a3",
      "annotationProcessingStage": "STAGE1"
    }
  ],
  "processedText": "ORDER BELOW EXH. 4 IN CRI. MISC. APPLICATION No. 14/2019 (Kamlesh Desai etc.1 Vs. State of Maharashtra) CNR : MHST01-000164-2019 \r\n---header-ends---\r\n1) Present application is filed by the applicants under section 438 of Criminal Procedure Code, 1973 apprehending their arrest as a result of complaint dated 06.01.2019 filed by Rajusinh Jogsinh suspecting applicants\u0027 involvement in the offence of kidnapping, wrongful confinement, voluntarily causing hurt and extortion etc. \r\n---background-ends---\r\n2) Alongwith said pre­arrest bail application, the applicant has also preferred ad­interim pre­arrest bail application at Exh. 4. \r\n---argument-ends---\r\n3) Advocate for applicants contended that, applicant no.1 had filed Criminal case on 15.06.2018 under Sec. 420, 406 r/w 34 of I.P.C. against the present complainant as he has taken Rs.5,00,000/­ from the applicant no.1 and to avoid its repayment, he filed false case against the present applicants. \r\n---argument-ends---\r\n4) Advocate for applicant argued that, applicants are innocent and assured that, they will neither tamper nor hamper with prosecution witnesses if they are released on anticipatory bail. It is also argued that, applicants having no connection with this alleged offence and they are falsely involved in this crime. \r\n---argument-ends---\r\n5) Upon perusing FIR, hearing advocate for applicants, it appears that, applicants for the time being can be provided interim pre­arrest bail atleast till filing of say by A.P.P./I.O. Accordingly, I proceed to pass the following order. \r\n---argument-ends---\r\nORDER 1) Application Exh. 4 is granted. 2) In the event of arrest of applicant no.1 Kamlesh Thanaramji Desai and applicant no.2 Harlal Ganpatram Sigand, they be released on interim pre­arrest bail, in respect of the complaint filed by Rajusinh Jogsinh dated 06.01.2019 on his furnishing personal bond of Rs. 25,000/­ (Rs. Twenty Fiuve Thousand), each with one or more surety/ies, till filing of say by prosecution/I.O. on following terms \u0026 conditions : a) Applicants shall attend the concern police station twice in a week preferably on every Tuesday and Friday in between 11:00 a.m. to 2.00 p.m. b) Applicants shall not directly or indirectly make any inducement, threat or promise to any person acquainted with the facts of the case so as to dissuade them from disclosing such facts to the court or to any Police Officer. c) Applicants shall make available themselves and co­ operate for interrogation by Police Officer as and when required and shall co­operate in the investigation of the present C.R. d) Applicants shall not tamper any of the documents connected to the present C.R. under investigation. e) Applicants shall also produce the documents called by the I.O. during the course of his investigation. f) Issue notice to Public Prosecutor as to why interim pre­arrest bail granted to the applicants shall not be confirmed. \r\n---order-ends---\r\nNotice r/o. (B.S.Wavre) Place : Satara Addl. Sessions Judge Date : 10th January, 2019 Satara"
}