{
  "header": "ORDER BELOW EXH. 4 IN CRI. MISC. APPLICATION No. 41/2019 (Rajendra Jadhav etc.1 Vs. State of Maharashtra) CNR : MHST01-000245-2019",
  "background": {
    "text": "1) Present application is filed by the applicants under section 438 of Criminal Procedure Code, 1973 apprehending their arrest as a result of complaint dated 17.01.2019 filed by Tukaram Dhondiba Kamble suspecting applicants\u0027 involvement in the offence of pun/u/Sec. 408 of Indian Penal Code.",
    "legalReferences": [
      {
        "refNumber": 1,
        "legalActFound": {
          "actNameMatched": "Criminal Procedure Code",
          "sectionsMatched": "438",
          "stringMatched": "under section 438 of criminal procedure code",
          "legalAct": {
            "actId": 1,
            "actName": "Code of Criminal Procedure",
            "actShortNameList": "CrPC,Cr.PC,Cr. P. C.,Cr.P.C.,Criminal Procedure Code",
            "actYear": "1973",
            "minSectionNumber": "1",
            "maxSectionNumber": "484"
          }
        },
        "legalRefAcceptRejectDecision": "TBD",
        "legalRefAcceptRejectDecisionAnnotations": [
          {
            "username": "a1",
            "legalRefAcceptRejectDecision": "TBD"
          },
          {
            "username": "a2",
            "legalRefAcceptRejectDecision": "TBD"
          },
          {
            "username": "a3",
            "legalRefAcceptRejectDecision": "TBD"
          }
        ]
      },
      {
        "refNumber": 2,
        "legalActFound": {
          "actNameMatched": "Indian Penal Code",
          "sectionsMatched": "408",
          "stringMatched": "u/sec. 408 of indian penal code",
          "legalAct": {
            "actId": 2,
            "actName": "Indian Penal Code",
            "actShortNameList": "IPC,I.P.C.,I.P.C",
            "actYear": "1860",
            "minSectionNumber": "1",
            "maxSectionNumber": "511"
          }
        },
        "legalRefAcceptRejectDecision": "TBD",
        "legalRefAcceptRejectDecisionAnnotations": [
          {
            "username": "a1",
            "legalRefAcceptRejectDecision": "TBD"
          },
          {
            "username": "a2",
            "legalRefAcceptRejectDecision": "TBD"
          },
          {
            "username": "a3",
            "legalRefAcceptRejectDecision": "TBD"
          }
        ]
      }
    ]
  },
  "arguments": [
    {
      "argumentNumber": 1,
      "text": "2) Alongwith said pre­arrest bail application, the applicant has also preferred ad­interim pre­arrest bail application at Exh. 4.",
      "argumentBy": "TBD",
      "argumentByAnnotations": [
        {
          "username": "a1",
          "argumentBy": "TBD"
        },
        {
          "username": "a2",
          "argumentBy": "TBD"
        },
        {
          "username": "a3",
          "argumentBy": "TBD"
        }
      ],
      "argumentSentences": [
        {
          "sentenceNumber": 1,
          "text": "2) Alongwith said pre­arrest bail application, the applicant has also preferred ad­interim pre­arrest bail application at Exh. 4.",
          "argumentSentenceType": "TBD",
          "argumentSentenceTypeAnnotations": [
            {
              "username": "a1",
              "argumentSentenceType": "TBD"
            },
            {
              "username": "a2",
              "argumentSentenceType": "TBD"
            },
            {
              "username": "a3",
              "argumentSentenceType": "TBD"
            }
          ]
        }
      ]
    },
    {
      "argumentNumber": 2,
      "text": "3) Advocate for applicants contended that, the accusation against the applicants is totally false, the applicants have no concern with the alleged offence, applicant no. 1, 2 are the employee of the Said Credit Society and applicant no.3 is retired employee of the same, all the documents regarding shares of the members were in custody of Managing Committee and applicants have no concerned with the same, they are innocent, applicants have strong apprehension of arrest, hence they prayed for ad­interim pre­arrest bail in the matter.",
      "argumentBy": "TBD",
      "argumentByAnnotations": [
        {
          "username": "a1",
          "argumentBy": "TBD"
        },
        {
          "username": "a2",
          "argumentBy": "TBD"
        },
        {
          "username": "a3",
          "argumentBy": "TBD"
        }
      ],
      "argumentSentences": [
        {
          "sentenceNumber": 1,
          "text": "3) Advocate for applicants contended that, the accusation against the applicants is totally false, the applicants have no concern with the alleged offence, applicant no. 1, 2 are the employee of the Said Credit Society and applicant no.3 is retired employee of the same, all the documents regarding shares of the members were in custody of Managing Committee and applicants have no concerned with the same, they are innocent, applicants have strong apprehension of arrest, hence they prayed for ad­interim pre­arrest bail in the matter.",
          "argumentSentenceType": "TBD",
          "argumentSentenceTypeAnnotations": [
            {
              "username": "a1",
              "argumentSentenceType": "TBD"
            },
            {
              "username": "a2",
              "argumentSentenceType": "TBD"
            },
            {
              "username": "a3",
              "argumentSentenceType": "TBD"
            }
          ]
        }
      ]
    },
    {
      "argumentNumber": 3,
      "text": "4) Advocate for applicant argued that, applicants are innocent and assured that, they will neither tamper nor hamper with prosecution witnesses if they are released on interim­anticipatory bail. It is also argued that, applicants having no connection with this alleged offence and they are falsely involved in this crime.",
      "argumentBy": "TBD",
      "argumentByAnnotations": [
        {
          "username": "a1",
          "argumentBy": "TBD"
        },
        {
          "username": "a2",
          "argumentBy": "TBD"
        },
        {
          "username": "a3",
          "argumentBy": "TBD"
        }
      ],
      "argumentSentences": [
        {
          "sentenceNumber": 1,
          "text": "4) Advocate for applicant argued that, applicants are innocent and assured that, they will neither tamper nor hamper with prosecution witnesses if they are released on interim­anticipatory bail.",
          "argumentSentenceType": "TBD",
          "argumentSentenceTypeAnnotations": [
            {
              "username": "a1",
              "argumentSentenceType": "TBD"
            },
            {
              "username": "a2",
              "argumentSentenceType": "TBD"
            },
            {
              "username": "a3",
              "argumentSentenceType": "TBD"
            }
          ]
        },
        {
          "sentenceNumber": 2,
          "text": "It is also argued that, applicants having no connection with this alleged offence and they are falsely involved in this crime.",
          "argumentSentenceType": "TBD",
          "argumentSentenceTypeAnnotations": [
            {
              "username": "a1",
              "argumentSentenceType": "TBD"
            },
            {
              "username": "a2",
              "argumentSentenceType": "TBD"
            },
            {
              "username": "a3",
              "argumentSentenceType": "TBD"
            }
          ]
        }
      ]
    },
    {
      "argumentNumber": 4,
      "text": "5) It appears that, FIR is disclosing the names of the applicants and one another, however, it is not disclosing in what capacity, the accused­applicants had misappropriated the amount. On the contrary, it seems that, informant was aware about the information given by the concerned society that, payment was made to him since 2007. It also seems that, he has moved for the claim of amount and lastly after 10 years of having knowledge of the facts he lodged FIR.",
      "argumentBy": "TBD",
      "argumentByAnnotations": [
        {
          "username": "a1",
          "argumentBy": "TBD"
        },
        {
          "username": "a2",
          "argumentBy": "TBD"
        },
        {
          "username": "a3",
          "argumentBy": "TBD"
        }
      ],
      "argumentSentences": [
        {
          "sentenceNumber": 1,
          "text": "5) It appears that, FIR is disclosing the names of the applicants and one another, however, it is not disclosing in what capacity, the accused­applicants had misappropriated the amount.",
          "argumentSentenceType": "TBD",
          "argumentSentenceTypeAnnotations": [
            {
              "username": "a1",
              "argumentSentenceType": "TBD"
            },
            {
              "username": "a2",
              "argumentSentenceType": "TBD"
            },
            {
              "username": "a3",
              "argumentSentenceType": "TBD"
            }
          ]
        },
        {
          "sentenceNumber": 2,
          "text": "On the contrary, it seems that, informant was aware about the information given by the concerned society that, payment was made to him since 2007.",
          "argumentSentenceType": "TBD",
          "argumentSentenceTypeAnnotations": [
            {
              "username": "a1",
              "argumentSentenceType": "TBD"
            },
            {
              "username": "a2",
              "argumentSentenceType": "TBD"
            },
            {
              "username": "a3",
              "argumentSentenceType": "TBD"
            }
          ]
        },
        {
          "sentenceNumber": 3,
          "text": "It also seems that, he has moved for the claim of amount and lastly after 10 years of having knowledge of the facts he lodged FIR.",
          "argumentSentenceType": "TBD",
          "argumentSentenceTypeAnnotations": [
            {
              "username": "a1",
              "argumentSentenceType": "TBD"
            },
            {
              "username": "a2",
              "argumentSentenceType": "TBD"
            },
            {
              "username": "a3",
              "argumentSentenceType": "TBD"
            }
          ]
        }
      ]
    },
    {
      "argumentNumber": 5,
      "text": "6) Facts will be disclosed by the prosecution after filing say, hence, till filing say by prosecution, application may be allowed.",
      "argumentBy": "TBD",
      "argumentByAnnotations": [
        {
          "username": "a1",
          "argumentBy": "TBD"
        },
        {
          "username": "a2",
          "argumentBy": "TBD"
        },
        {
          "username": "a3",
          "argumentBy": "TBD"
        }
      ],
      "argumentSentences": [
        {
          "sentenceNumber": 1,
          "text": "6) Facts will be disclosed by the prosecution after filing say, hence, till filing say by prosecution, application may be allowed.",
          "argumentSentenceType": "TBD",
          "argumentSentenceTypeAnnotations": [
            {
              "username": "a1",
              "argumentSentenceType": "TBD"
            },
            {
              "username": "a2",
              "argumentSentenceType": "TBD"
            },
            {
              "username": "a3",
              "argumentSentenceType": "TBD"
            }
          ]
        }
      ]
    }
  ],
  "order": {
    "text": "ORDER 1) Application Exh. 4 is allowed. 2) In the event of arrest of applicant no.1 Rajendra Bapu Jadhav, applicant no.2 Sanjay Shivling Todkar and applicant no.3 Pradeep Shankar Chorge they be released on interim pre­arrest bail, in respect of the complaint filed by Tukaram Dhondiba Kamble in C.R.No. 53 of 2019 on their furnishing personal bond of Rs. 25,000/­ (Rs. Twenty Fiuve Thousand), each with one or more surety/ies, till filing of say by prosecution/I.O. on following terms \u0026 conditions : a) Applicants shall not directly or indirectly make any inducement, threat or promise to any person acquainted with the facts of the case so as to dissuade them from disclosing such facts to the court or to any Police Officer. c) Applicants shall make available themselves and co­ operate for interrogation by Police Officer as and when required and shall co­operate in the investigation of the present C.R. d) Applicants shall not tamper any of the documents connected to the present C.R. under investigation. e) Applicants shall also produce the documents called by the I.O. during the course of his investigation. f) Issue notice to Public Prosecutor as to why interim pre­arrest bail granted to the applicants shall not be confirmed.",
    "orderType": "TBD",
    "orderTypeAnnotations": [
      {
        "username": "a1",
        "orderType": "TBD"
      },
      {
        "username": "a2",
        "orderType": "TBD"
      },
      {
        "username": "a3",
        "orderType": "TBD"
      }
    ],
    "bondAmount": "0",
    "bondAmountAnnotations": [
      {
        "username": "a1",
        "bondAmount": "0"
      },
      {
        "username": "a2",
        "bondAmount": "0"
      },
      {
        "username": "a3",
        "bondAmount": "0"
      }
    ],
    "attendPoliceStationRecurrence": "NA",
    "attendPoliceStationRecurrenceAnnotations": [
      {
        "username": "a1",
        "attendPoliceStationRecurrence": "NA"
      },
      {
        "username": "a2",
        "attendPoliceStationRecurrence": "NA"
      },
      {
        "username": "a3",
        "attendPoliceStationRecurrence": "NA"
      }
    ],
    "attendPoliceStationFrequency": "0",
    "attendPoliceStationFrequencyAnnotations": [
      {
        "username": "a1",
        "attendPoliceStationFrequency": "0"
      },
      {
        "username": "a2",
        "attendPoliceStationFrequency": "0"
      },
      {
        "username": "a3",
        "attendPoliceStationFrequency": "0"
      }
    ]
  },
  "footer": "Notice r/o. 25.01.2019. (B.S.Wavre) Place : Satara Addl. Sessions Judge Date : 21st January, 2019 Satara",
  "annotationProcessingStage": "STAGE1",
  "annotationProcessingStageAnnotations": [
    {
      "username": "a1",
      "annotationProcessingStage": "STAGE1"
    },
    {
      "username": "a2",
      "annotationProcessingStage": "STAGE1"
    },
    {
      "username": "a3",
      "annotationProcessingStage": "STAGE1"
    }
  ],
  "processedText": "ORDER BELOW EXH. 4 IN CRI. MISC. APPLICATION No. 41/2019 (Rajendra Jadhav etc.1 Vs. State of Maharashtra) CNR : MHST01-000245-2019 \r\n---header-ends---\r\n1) Present application is filed by the applicants under section 438 of Criminal Procedure Code, 1973 apprehending their arrest as a result of complaint dated 17.01.2019 filed by Tukaram Dhondiba Kamble suspecting applicants\u0027 involvement in the offence of pun/u/Sec. 408 of Indian Penal Code. \r\n---background-ends---\r\n2) Alongwith said pre­arrest bail application, the applicant has also preferred ad­interim pre­arrest bail application at Exh. 4. \r\n---argument-ends---\r\n3) Advocate for applicants contended that, the accusation against the applicants is totally false, the applicants have no concern with the alleged offence, applicant no. 1, 2 are the employee of the Said Credit Society and applicant no.3 is retired employee of the same, all the documents regarding shares of the members were in custody of Managing Committee and applicants have no concerned with the same, they are innocent, applicants have strong apprehension of arrest, hence they prayed for ad­interim pre­arrest bail in the matter. \r\n---argument-ends---\r\n4) Advocate for applicant argued that, applicants are innocent and assured that, they will neither tamper nor hamper with prosecution witnesses if they are released on interim­anticipatory bail. It is also argued that, applicants having no connection with this alleged offence and they are falsely involved in this crime. \r\n---argument-ends---\r\n5) It appears that, FIR is disclosing the names of the applicants and one another, however, it is not disclosing in what capacity, the accused­applicants had misappropriated the amount. On the contrary, it seems that, informant was aware about the information given by the concerned society that, payment was made to him since 2007. It also seems that, he has moved for the claim of amount and lastly after 10 years of having knowledge of the facts he lodged FIR. \r\n---argument-ends---\r\n6) Facts will be disclosed by the prosecution after filing say, hence, till filing say by prosecution, application may be allowed. \r\n---argument-ends---\r\nORDER 1) Application Exh. 4 is allowed. 2) In the event of arrest of applicant no.1 Rajendra Bapu Jadhav, applicant no.2 Sanjay Shivling Todkar and applicant no.3 Pradeep Shankar Chorge they be released on interim pre­arrest bail, in respect of the complaint filed by Tukaram Dhondiba Kamble in C.R.No. 53 of 2019 on their furnishing personal bond of Rs. 25,000/­ (Rs. Twenty Fiuve Thousand), each with one or more surety/ies, till filing of say by prosecution/I.O. on following terms \u0026 conditions : a) Applicants shall not directly or indirectly make any inducement, threat or promise to any person acquainted with the facts of the case so as to dissuade them from disclosing such facts to the court or to any Police Officer. c) Applicants shall make available themselves and co­ operate for interrogation by Police Officer as and when required and shall co­operate in the investigation of the present C.R. d) Applicants shall not tamper any of the documents connected to the present C.R. under investigation. e) Applicants shall also produce the documents called by the I.O. during the course of his investigation. f) Issue notice to Public Prosecutor as to why interim pre­arrest bail granted to the applicants shall not be confirmed. \r\n---order-ends---\r\nNotice r/o. 25.01.2019. (B.S.Wavre) Place : Satara Addl. Sessions Judge Date : 21st January, 2019 Satara"
}