{
  "header": "ORDER BELOW EXH.1 IN CRIMINAL BAIL APPLICATION No. 50 of 2019 (Dhanashri Vijay Shinde etc.1 Vs. State of Maharashtra) CNR : MHST01­000285­2019",
  "background": {
    "text": "1) This the bail application under Sec. 439 of Code of Criminal Procedure is filed by applicants­accused in C.R.No. 22 of 2019 registered with Wai Police Station. 2) Accused were arrested in above mentioned crime on 21.01.2019. The said crime is registered in respect of the offene punishable under Section332, 353, 352, 504, 506 r/w 34 of Indian Penal Code.",
    "legalReferences": [
      {
        "refNumber": 1,
        "legalActFound": {
          "actNameMatched": "Indian Penal Code",
          "sectionsMatched": "332,353,352,504,506,34",
          "stringMatched": "under section332, 353, 352, 504, 506 r/w 34 of indian penal code",
          "legalAct": {
            "actId": 2,
            "actName": "Indian Penal Code",
            "actShortNameList": "IPC,I.P.C.,I.P.C",
            "actYear": "1860",
            "minSectionNumber": "1",
            "maxSectionNumber": "511"
          }
        },
        "legalRefAcceptRejectDecision": "TBD",
        "legalRefAcceptRejectDecisionAnnotations": [
          {
            "username": "a1",
            "legalRefAcceptRejectDecision": "TBD"
          },
          {
            "username": "a2",
            "legalRefAcceptRejectDecision": "TBD"
          },
          {
            "username": "a3",
            "legalRefAcceptRejectDecision": "TBD"
          }
        ]
      }
    ]
  },
  "arguments": [
    {
      "argumentNumber": 1,
      "text": "Accused are at present in Magisterial Custody. It is stated that, applicants are having house and landed property at the address mentioned, there is no possibility of fleeing, applicants are only earning members of their families, they undertake to abide by the conditions imposed if any.",
      "argumentBy": "TBD",
      "argumentByAnnotations": [
        {
          "username": "a1",
          "argumentBy": "TBD"
        },
        {
          "username": "a2",
          "argumentBy": "TBD"
        },
        {
          "username": "a3",
          "argumentBy": "TBD"
        }
      ],
      "argumentSentences": [
        {
          "sentenceNumber": 1,
          "text": "Accused are at present in Magisterial Custody.",
          "argumentSentenceType": "TBD",
          "argumentSentenceTypeAnnotations": [
            {
              "username": "a1",
              "argumentSentenceType": "TBD"
            },
            {
              "username": "a2",
              "argumentSentenceType": "TBD"
            },
            {
              "username": "a3",
              "argumentSentenceType": "TBD"
            }
          ]
        },
        {
          "sentenceNumber": 2,
          "text": "It is stated that, applicants are having house and landed property at the address mentioned, there is no possibility of fleeing, applicants are only earning members of their families, they undertake to abide by the conditions imposed if any.",
          "argumentSentenceType": "TBD",
          "argumentSentenceTypeAnnotations": [
            {
              "username": "a1",
              "argumentSentenceType": "TBD"
            },
            {
              "username": "a2",
              "argumentSentenceType": "TBD"
            },
            {
              "username": "a3",
              "argumentSentenceType": "TBD"
            }
          ]
        }
      ]
    },
    {
      "argumentNumber": 2,
      "text": "3) The prosecution has filed its say at Exh. 5. It is contended that, A.P.I of Wai police station has no objection to grant bail, hence necessary orders may be passed.",
      "argumentBy": "TBD",
      "argumentByAnnotations": [
        {
          "username": "a1",
          "argumentBy": "TBD"
        },
        {
          "username": "a2",
          "argumentBy": "TBD"
        },
        {
          "username": "a3",
          "argumentBy": "TBD"
        }
      ],
      "argumentSentences": [
        {
          "sentenceNumber": 1,
          "text": "3) The prosecution has filed its say at Exh. 5.",
          "argumentSentenceType": "TBD",
          "argumentSentenceTypeAnnotations": [
            {
              "username": "a1",
              "argumentSentenceType": "TBD"
            },
            {
              "username": "a2",
              "argumentSentenceType": "TBD"
            },
            {
              "username": "a3",
              "argumentSentenceType": "TBD"
            }
          ]
        },
        {
          "sentenceNumber": 2,
          "text": "It is contended that, A.P.I of Wai police station has no objection to grant bail, hence necessary orders may be passed.",
          "argumentSentenceType": "TBD",
          "argumentSentenceTypeAnnotations": [
            {
              "username": "a1",
              "argumentSentenceType": "TBD"
            },
            {
              "username": "a2",
              "argumentSentenceType": "TBD"
            },
            {
              "username": "a3",
              "argumentSentenceType": "TBD"
            }
          ]
        }
      ]
    },
    {
      "argumentNumber": 3,
      "text": "4) Heard learned Advocate for the applicant­accused.",
      "argumentBy": "TBD",
      "argumentByAnnotations": [
        {
          "username": "a1",
          "argumentBy": "TBD"
        },
        {
          "username": "a2",
          "argumentBy": "TBD"
        },
        {
          "username": "a3",
          "argumentBy": "TBD"
        }
      ],
      "argumentSentences": [
        {
          "sentenceNumber": 1,
          "text": "4) Heard learned Advocate for the applicant­accused.",
          "argumentSentenceType": "TBD",
          "argumentSentenceTypeAnnotations": [
            {
              "username": "a1",
              "argumentSentenceType": "TBD"
            },
            {
              "username": "a2",
              "argumentSentenceType": "TBD"
            },
            {
              "username": "a3",
              "argumentSentenceType": "TBD"
            }
          ]
        }
      ]
    },
    {
      "argumentNumber": 4,
      "text": "5) Considering the nature of offence and no objection of prosecution, accused may be released on bail. Accused are in custody since 21th January, 2019. Considering these facts, applicant­accused may be released on bail. Hence, following order.",
      "argumentBy": "TBD",
      "argumentByAnnotations": [
        {
          "username": "a1",
          "argumentBy": "TBD"
        },
        {
          "username": "a2",
          "argumentBy": "TBD"
        },
        {
          "username": "a3",
          "argumentBy": "TBD"
        }
      ],
      "argumentSentences": [
        {
          "sentenceNumber": 1,
          "text": "5) Considering the nature of offence and no objection of prosecution, accused may be released on bail.",
          "argumentSentenceType": "TBD",
          "argumentSentenceTypeAnnotations": [
            {
              "username": "a1",
              "argumentSentenceType": "TBD"
            },
            {
              "username": "a2",
              "argumentSentenceType": "TBD"
            },
            {
              "username": "a3",
              "argumentSentenceType": "TBD"
            }
          ]
        },
        {
          "sentenceNumber": 2,
          "text": "Accused are in custody since 21th January, 2019.",
          "argumentSentenceType": "TBD",
          "argumentSentenceTypeAnnotations": [
            {
              "username": "a1",
              "argumentSentenceType": "TBD"
            },
            {
              "username": "a2",
              "argumentSentenceType": "TBD"
            },
            {
              "username": "a3",
              "argumentSentenceType": "TBD"
            }
          ]
        },
        {
          "sentenceNumber": 3,
          "text": "Considering these facts, applicant­accused may be released on bail.",
          "argumentSentenceType": "TBD",
          "argumentSentenceTypeAnnotations": [
            {
              "username": "a1",
              "argumentSentenceType": "TBD"
            },
            {
              "username": "a2",
              "argumentSentenceType": "TBD"
            },
            {
              "username": "a3",
              "argumentSentenceType": "TBD"
            }
          ]
        },
        {
          "sentenceNumber": 4,
          "text": "Hence, following order.",
          "argumentSentenceType": "TBD",
          "argumentSentenceTypeAnnotations": [
            {
              "username": "a1",
              "argumentSentenceType": "TBD"
            },
            {
              "username": "a2",
              "argumentSentenceType": "TBD"
            },
            {
              "username": "a3",
              "argumentSentenceType": "TBD"
            }
          ]
        }
      ]
    }
  ],
  "order": {
    "text": "O R D E R 1) Criminal Bail Application no. 50 of 2019, is allowed. 2) Applicant­accused Dhanashri Vijay Shinde and Anand Bhimrao Shinde be released on bail on his furnishing P.R.Bond of Rs.15,000/­ (Rs. Fifteen Thousand) with one or two surety / sureties of like amount with following conditions. a) Accused shall not tamper with any evidence. b) Accused shall not directly or indirectly make any inducement, threat or promise to any person acquainted with the facts of the case so as to dissuade him from disclosing such facts to the court or to any Police Officer. c) Accused shall make available themselves and co­operate for interrogation by Police Officer as and when required. d) Any default of above conditions shall render the bail to be cancelled automatically. e) Compliance before lower Court.",
    "orderType": "TBD",
    "orderTypeAnnotations": [
      {
        "username": "a1",
        "orderType": "TBD"
      },
      {
        "username": "a2",
        "orderType": "TBD"
      },
      {
        "username": "a3",
        "orderType": "TBD"
      }
    ],
    "bondAmount": "0",
    "bondAmountAnnotations": [
      {
        "username": "a1",
        "bondAmount": "0"
      },
      {
        "username": "a2",
        "bondAmount": "0"
      },
      {
        "username": "a3",
        "bondAmount": "0"
      }
    ],
    "attendPoliceStationRecurrence": "NA",
    "attendPoliceStationRecurrenceAnnotations": [
      {
        "username": "a1",
        "attendPoliceStationRecurrence": "NA"
      },
      {
        "username": "a2",
        "attendPoliceStationRecurrence": "NA"
      },
      {
        "username": "a3",
        "attendPoliceStationRecurrence": "NA"
      }
    ],
    "attendPoliceStationFrequency": "0",
    "attendPoliceStationFrequencyAnnotations": [
      {
        "username": "a1",
        "attendPoliceStationFrequency": "0"
      },
      {
        "username": "a2",
        "attendPoliceStationFrequency": "0"
      },
      {
        "username": "a3",
        "attendPoliceStationFrequency": "0"
      }
    ]
  },
  "footer": "(B.S.Wavre) Place : Satara Addl. Sessions Judge Date :29th January, 2019. Satara",
  "annotationProcessingStage": "STAGE1",
  "annotationProcessingStageAnnotations": [
    {
      "username": "a1",
      "annotationProcessingStage": "STAGE1"
    },
    {
      "username": "a2",
      "annotationProcessingStage": "STAGE1"
    },
    {
      "username": "a3",
      "annotationProcessingStage": "STAGE1"
    }
  ],
  "processedText": "ORDER BELOW EXH.1 IN CRIMINAL BAIL APPLICATION No. 50 of 2019 (Dhanashri Vijay Shinde etc.1 Vs. State of Maharashtra) CNR : MHST01­000285­2019 \r\n---header-ends---\r\n1) This the bail application under Sec. 439 of Code of Criminal Procedure is filed by applicants­accused in C.R.No. 22 of 2019 registered with Wai Police Station. 2) Accused were arrested in above mentioned crime on 21.01.2019. The said crime is registered in respect of the offene punishable under Section332, 353, 352, 504, 506 r/w 34 of Indian Penal Code. \r\n---background-ends---\r\nAccused are at present in Magisterial Custody. It is stated that, applicants are having house and landed property at the address mentioned, there is no possibility of fleeing, applicants are only earning members of their families, they undertake to abide by the conditions imposed if any.\r\n---argument-ends---\r\n3) The prosecution has filed its say at Exh. 5. It is contended that, A.P.I of Wai police station has no objection to grant bail, hence necessary orders may be passed. \r\n---argument-ends---\r\n4) Heard learned Advocate for the applicant­accused. \r\n---argument-ends---\r\n5) Considering the nature of offence and no objection of prosecution, accused may be released on bail. Accused are in custody since 21th January, 2019. Considering these facts, applicant­accused may be released on bail. Hence, following order. \r\n---argument-ends---\r\nO R D E R 1) Criminal Bail Application no. 50 of 2019, is allowed. 2) Applicant­accused Dhanashri Vijay Shinde and Anand Bhimrao Shinde be released on bail on his furnishing P.R.Bond of Rs.15,000/­ (Rs. Fifteen Thousand) with one or two surety / sureties of like amount with following conditions. a) Accused shall not tamper with any evidence. b) Accused shall not directly or indirectly make any inducement, threat or promise to any person acquainted with the facts of the case so as to dissuade him from disclosing such facts to the court or to any Police Officer. c) Accused shall make available themselves and co­operate for interrogation by Police Officer as and when required. d) Any default of above conditions shall render the bail to be cancelled automatically. e) Compliance before lower Court. \r\n---order-ends---\r\n(B.S.Wavre) Place : Satara Addl. Sessions Judge Date :29th January, 2019. Satara"
}