{
  "header": "ORDER BELOW EXH. 1 IN CRI. BAIL APPLICATION No. 67/2019 (Hajisaheb Mosin Inamdar Vs. State of Maharashtra) CNR : MHST01足000381足2019",
  "background": {
    "text": "1) Present application is filed by the applicant under section 438 of Criminal Procedure Code, 1973 apprehending his arrest as a result of C.R.No. 379/2017 suspecting applicant\u0027s involvement in the offence of pun/u/Sec. 395, 324, 323, 504, 506 of Indian Penal Code and Sec. 39, 45 of Money Lender\u0027s Act 1946.",
    "legalReferences": [
      {
        "refNumber": 1,
        "legalActFound": {
          "actNameMatched": "Criminal Procedure Code",
          "sectionsMatched": "438",
          "stringMatched": "under section 438 of criminal procedure code",
          "legalAct": {
            "actId": 1,
            "actName": "Code of Criminal Procedure",
            "actShortNameList": "CrPC,Cr.PC,Cr. P. C.,Cr.P.C.,Criminal Procedure Code",
            "actYear": "1973",
            "minSectionNumber": "1",
            "maxSectionNumber": "484"
          }
        },
        "legalRefAcceptRejectDecision": "TBD",
        "legalRefAcceptRejectDecisionAnnotations": [
          {
            "username": "a1",
            "legalRefAcceptRejectDecision": "TBD"
          },
          {
            "username": "a2",
            "legalRefAcceptRejectDecision": "TBD"
          },
          {
            "username": "a3",
            "legalRefAcceptRejectDecision": "TBD"
          }
        ]
      },
      {
        "refNumber": 2,
        "legalActFound": {
          "actNameMatched": "Indian Penal Code",
          "sectionsMatched": "395,324,323,504,506",
          "stringMatched": "u/sec. 395, 324, 323, 504, 506 of indian penal code",
          "legalAct": {
            "actId": 2,
            "actName": "Indian Penal Code",
            "actShortNameList": "IPC,I.P.C.,I.P.C",
            "actYear": "1860",
            "minSectionNumber": "1",
            "maxSectionNumber": "511"
          }
        },
        "legalRefAcceptRejectDecision": "TBD",
        "legalRefAcceptRejectDecisionAnnotations": [
          {
            "username": "a1",
            "legalRefAcceptRejectDecision": "TBD"
          },
          {
            "username": "a2",
            "legalRefAcceptRejectDecision": "TBD"
          },
          {
            "username": "a3",
            "legalRefAcceptRejectDecision": "TBD"
          }
        ]
      }
    ]
  },
  "arguments": [
    {
      "argumentNumber": 1,
      "text": "2) It is alleged that, present applicant is involved in a crime alongwith the other accused for the offences of extortion, kidnapping, voluntarily causing hurt to the complainant Sachin Chandrakant Gangawane, who allegedly lost his money and landed property.",
      "argumentBy": "TBD",
      "argumentByAnnotations": [
        {
          "username": "a1",
          "argumentBy": "TBD"
        },
        {
          "username": "a2",
          "argumentBy": "TBD"
        },
        {
          "username": "a3",
          "argumentBy": "TBD"
        }
      ],
      "argumentSentences": [
        {
          "sentenceNumber": 1,
          "text": "2) It is alleged that, present applicant is involved in a crime alongwith the other accused for the offences of extortion, kidnapping, voluntarily causing hurt to the complainant Sachin Chandrakant Gangawane, who allegedly lost his money and landed property.",
          "argumentSentenceType": "TBD",
          "argumentSentenceTypeAnnotations": [
            {
              "username": "a1",
              "argumentSentenceType": "TBD"
            },
            {
              "username": "a2",
              "argumentSentenceType": "TBD"
            },
            {
              "username": "a3",
              "argumentSentenceType": "TBD"
            }
          ]
        }
      ]
    },
    {
      "argumentNumber": 2,
      "text": "3) It is contended that, the accusation against the applicant is totally false, he is innocent person and nothing to do with the offence, he has no previous criminal record, there is no nexus between the said crime, investigation of the crime has been already completed and charge足sheet has also been filed bearing R.C.C.No. 463/2017, therefore, there will be no custodial interrogation of this applicant. Hence, he prayed for anticipatory bail.",
      "argumentBy": "TBD",
      "argumentByAnnotations": [
        {
          "username": "a1",
          "argumentBy": "TBD"
        },
        {
          "username": "a2",
          "argumentBy": "TBD"
        },
        {
          "username": "a3",
          "argumentBy": "TBD"
        }
      ],
      "argumentSentences": [
        {
          "sentenceNumber": 1,
          "text": "3) It is contended that, the accusation against the applicant is totally false, he is innocent person and nothing to do with the offence, he has no previous criminal record, there is no nexus between the said crime, investigation of the crime has been already completed and charge足sheet has also been filed bearing R.C.C.No.",
          "argumentSentenceType": "TBD",
          "argumentSentenceTypeAnnotations": [
            {
              "username": "a1",
              "argumentSentenceType": "TBD"
            },
            {
              "username": "a2",
              "argumentSentenceType": "TBD"
            },
            {
              "username": "a3",
              "argumentSentenceType": "TBD"
            }
          ]
        },
        {
          "sentenceNumber": 2,
          "text": "463/2017, therefore, there will be no custodial interrogation of this applicant.",
          "argumentSentenceType": "TBD",
          "argumentSentenceTypeAnnotations": [
            {
              "username": "a1",
              "argumentSentenceType": "TBD"
            },
            {
              "username": "a2",
              "argumentSentenceType": "TBD"
            },
            {
              "username": "a3",
              "argumentSentenceType": "TBD"
            }
          ]
        },
        {
          "sentenceNumber": 3,
          "text": "Hence, he prayed for anticipatory bail.",
          "argumentSentenceType": "TBD",
          "argumentSentenceTypeAnnotations": [
            {
              "username": "a1",
              "argumentSentenceType": "TBD"
            },
            {
              "username": "a2",
              "argumentSentenceType": "TBD"
            },
            {
              "username": "a3",
              "argumentSentenceType": "TBD"
            }
          ]
        }
      ]
    },
    {
      "argumentNumber": 3,
      "text": "4) Advocate for applicant argued that, applicant is innocent, having no connection with the crime. He assured that, he will neither tamper nor hamper with prosecution witnesses if he is released on anticipatory bail. It is also argued that, he is permanent resident of the of Satara, ready to furnish bail by way of security of his presence before police or Court as and when required.",
      "argumentBy": "TBD",
      "argumentByAnnotations": [
        {
          "username": "a1",
          "argumentBy": "TBD"
        },
        {
          "username": "a2",
          "argumentBy": "TBD"
        },
        {
          "username": "a3",
          "argumentBy": "TBD"
        }
      ],
      "argumentSentences": [
        {
          "sentenceNumber": 1,
          "text": "4) Advocate for applicant argued that, applicant is innocent, having no connection with the crime.",
          "argumentSentenceType": "TBD",
          "argumentSentenceTypeAnnotations": [
            {
              "username": "a1",
              "argumentSentenceType": "TBD"
            },
            {
              "username": "a2",
              "argumentSentenceType": "TBD"
            },
            {
              "username": "a3",
              "argumentSentenceType": "TBD"
            }
          ]
        },
        {
          "sentenceNumber": 2,
          "text": "He assured that, he will neither tamper nor hamper with prosecution witnesses if he is released on anticipatory bail.",
          "argumentSentenceType": "TBD",
          "argumentSentenceTypeAnnotations": [
            {
              "username": "a1",
              "argumentSentenceType": "TBD"
            },
            {
              "username": "a2",
              "argumentSentenceType": "TBD"
            },
            {
              "username": "a3",
              "argumentSentenceType": "TBD"
            }
          ]
        },
        {
          "sentenceNumber": 3,
          "text": "It is also argued that, he is permanent resident of the of Satara, ready to furnish bail by way of security of his presence before police or Court as and when required.",
          "argumentSentenceType": "TBD",
          "argumentSentenceTypeAnnotations": [
            {
              "username": "a1",
              "argumentSentenceType": "TBD"
            },
            {
              "username": "a2",
              "argumentSentenceType": "TBD"
            },
            {
              "username": "a3",
              "argumentSentenceType": "TBD"
            }
          ]
        }
      ]
    },
    {
      "argumentNumber": 4,
      "text": "5) It is submitted on behalf of the prosecution that, applicant is involved in such type of two another offences, the documents regarding transfer of property is to be seized hence prayed for rejection of the application.",
      "argumentBy": "TBD",
      "argumentByAnnotations": [
        {
          "username": "a1",
          "argumentBy": "TBD"
        },
        {
          "username": "a2",
          "argumentBy": "TBD"
        },
        {
          "username": "a3",
          "argumentBy": "TBD"
        }
      ],
      "argumentSentences": [
        {
          "sentenceNumber": 1,
          "text": "5) It is submitted on behalf of the prosecution that, applicant is involved in such type of two another offences, the documents regarding transfer of property is to be seized hence prayed for rejection of the application.",
          "argumentSentenceType": "TBD",
          "argumentSentenceTypeAnnotations": [
            {
              "username": "a1",
              "argumentSentenceType": "TBD"
            },
            {
              "username": "a2",
              "argumentSentenceType": "TBD"
            },
            {
              "username": "a3",
              "argumentSentenceType": "TBD"
            }
          ]
        }
      ]
    },
    {
      "argumentNumber": 5,
      "text": "6) It appears that, charge足sheet is already filed, investigation is completed, FIR is not reflecting the direct involvement of the applicant足 accused in the alleged crime. Though his name is appearing in FIR, his role cannot be equated with the role with the role of main accused. Upon query, it is submitted that, accused is residing in Karnataka as he is cultivating the lands on lease basis. Considering the facts and the allegations against the accused, he may be granted anticipatory bail by imposing conditions. Hence, I pass following order.",
      "argumentBy": "TBD",
      "argumentByAnnotations": [
        {
          "username": "a1",
          "argumentBy": "TBD"
        },
        {
          "username": "a2",
          "argumentBy": "TBD"
        },
        {
          "username": "a3",
          "argumentBy": "TBD"
        }
      ],
      "argumentSentences": [
        {
          "sentenceNumber": 1,
          "text": "6) It appears that, charge足sheet is already filed, investigation is completed, FIR is not reflecting the direct involvement of the applicant足 accused in the alleged crime.",
          "argumentSentenceType": "TBD",
          "argumentSentenceTypeAnnotations": [
            {
              "username": "a1",
              "argumentSentenceType": "TBD"
            },
            {
              "username": "a2",
              "argumentSentenceType": "TBD"
            },
            {
              "username": "a3",
              "argumentSentenceType": "TBD"
            }
          ]
        },
        {
          "sentenceNumber": 2,
          "text": "Though his name is appearing in FIR, his role cannot be equated with the role with the role of main accused.",
          "argumentSentenceType": "TBD",
          "argumentSentenceTypeAnnotations": [
            {
              "username": "a1",
              "argumentSentenceType": "TBD"
            },
            {
              "username": "a2",
              "argumentSentenceType": "TBD"
            },
            {
              "username": "a3",
              "argumentSentenceType": "TBD"
            }
          ]
        },
        {
          "sentenceNumber": 3,
          "text": "Upon query, it is submitted that, accused is residing in Karnataka as he is cultivating the lands on lease basis.",
          "argumentSentenceType": "TBD",
          "argumentSentenceTypeAnnotations": [
            {
              "username": "a1",
              "argumentSentenceType": "TBD"
            },
            {
              "username": "a2",
              "argumentSentenceType": "TBD"
            },
            {
              "username": "a3",
              "argumentSentenceType": "TBD"
            }
          ]
        },
        {
          "sentenceNumber": 4,
          "text": "Considering the facts and the allegations against the accused, he may be granted anticipatory bail by imposing conditions.",
          "argumentSentenceType": "TBD",
          "argumentSentenceTypeAnnotations": [
            {
              "username": "a1",
              "argumentSentenceType": "TBD"
            },
            {
              "username": "a2",
              "argumentSentenceType": "TBD"
            },
            {
              "username": "a3",
              "argumentSentenceType": "TBD"
            }
          ]
        },
        {
          "sentenceNumber": 5,
          "text": "Hence, I pass following order.",
          "argumentSentenceType": "TBD",
          "argumentSentenceTypeAnnotations": [
            {
              "username": "a1",
              "argumentSentenceType": "TBD"
            },
            {
              "username": "a2",
              "argumentSentenceType": "TBD"
            },
            {
              "username": "a3",
              "argumentSentenceType": "TBD"
            }
          ]
        }
      ]
    }
  ],
  "order": {
    "text": "O R D E R 1) Criminal Bail Application no. 67 of 2019 is allowed. 2) In the event of arrest of applicant Hajisaheb Mosin Inamdar he be released on pre足arrest bail, in respect of the Crime No.379/2017 registered with Satara City Police Station on his furnishing personal bond of Rs.50,000/足 with one or more surety/ies. a) Applicant shall attend the concern police station twice in a week preferably on every Monday and Thursday in between 11:00 a.m. to 1.00 p.m. till filing of supplementary charge足sheet against him. b) Applicant shall not directly or indirectly make any inducement, threat or promise to any person acquainted with the facts of the case so as to dissuade them from disclosing such facts to the court or to any Police Officer. c) Applicant shall make available himself and co足operate for interrogation by Police Officer as and when required and shall co足operate in the investigation of the present C.R. d) Applicant shall not tamper any of the documents connected to the present C.R. under investigation. e) Applicant shall also produce the documents called by the I.O. during the course of his investigation.",
    "orderType": "TBD",
    "orderTypeAnnotations": [
      {
        "username": "a1",
        "orderType": "TBD"
      },
      {
        "username": "a2",
        "orderType": "TBD"
      },
      {
        "username": "a3",
        "orderType": "TBD"
      }
    ],
    "bondAmount": "0",
    "bondAmountAnnotations": [
      {
        "username": "a1",
        "bondAmount": "0"
      },
      {
        "username": "a2",
        "bondAmount": "0"
      },
      {
        "username": "a3",
        "bondAmount": "0"
      }
    ],
    "attendPoliceStationRecurrence": "NA",
    "attendPoliceStationRecurrenceAnnotations": [
      {
        "username": "a1",
        "attendPoliceStationRecurrence": "NA"
      },
      {
        "username": "a2",
        "attendPoliceStationRecurrence": "NA"
      },
      {
        "username": "a3",
        "attendPoliceStationRecurrence": "NA"
      }
    ],
    "attendPoliceStationFrequency": "0",
    "attendPoliceStationFrequencyAnnotations": [
      {
        "username": "a1",
        "attendPoliceStationFrequency": "0"
      },
      {
        "username": "a2",
        "attendPoliceStationFrequency": "0"
      },
      {
        "username": "a3",
        "attendPoliceStationFrequency": "0"
      }
    ]
  },
  "footer": "(B.S.Wavre) Place : Satara Addl. Sessions Judge Date : 21st February, 2019. Satara",
  "annotationProcessingStage": "STAGE1",
  "annotationProcessingStageAnnotations": [
    {
      "username": "a1",
      "annotationProcessingStage": "STAGE1"
    },
    {
      "username": "a2",
      "annotationProcessingStage": "STAGE1"
    },
    {
      "username": "a3",
      "annotationProcessingStage": "STAGE1"
    }
  ],
  "processedText": "ORDER BELOW EXH. 1 IN CRI. BAIL APPLICATION No. 67/2019 (Hajisaheb Mosin Inamdar Vs. State of Maharashtra) CNR : MHST01足000381足2019 \r\n---header-ends---\r\n1) Present application is filed by the applicant under section 438 of Criminal Procedure Code, 1973 apprehending his arrest as a result of C.R.No. 379/2017 suspecting applicant\u0027s involvement in the offence of pun/u/Sec. 395, 324, 323, 504, 506 of Indian Penal Code and Sec. 39, 45 of Money Lender\u0027s Act 1946. \r\n---background-ends---\r\n2) It is alleged that, present applicant is involved in a crime alongwith the other accused for the offences of extortion, kidnapping, voluntarily causing hurt to the complainant Sachin Chandrakant Gangawane, who allegedly lost his money and landed property. \r\n---argument-ends---\r\n3) It is contended that, the accusation against the applicant is totally false, he is innocent person and nothing to do with the offence, he has no previous criminal record, there is no nexus between the said crime, investigation of the crime has been already completed and charge足sheet has also been filed bearing R.C.C.No. 463/2017, therefore, there will be no custodial interrogation of this applicant. Hence, he prayed for anticipatory bail. \r\n---argument-ends---\r\n4) Advocate for applicant argued that, applicant is innocent, having no connection with the crime. He assured that, he will neither tamper nor hamper with prosecution witnesses if he is released on anticipatory bail. It is also argued that, he is permanent resident of the of Satara, ready to furnish bail by way of security of his presence before police or Court as and when required. \r\n---argument-ends---\r\n5) It is submitted on behalf of the prosecution that, applicant is involved in such type of two another offences, the documents regarding transfer of property is to be seized hence prayed for rejection of the application. \r\n---argument-ends---\r\n6) It appears that, charge足sheet is already filed, investigation is completed, FIR is not reflecting the direct involvement of the applicant足 accused in the alleged crime. Though his name is appearing in FIR, his role cannot be equated with the role with the role of main accused. Upon query, it is submitted that, accused is residing in Karnataka as he is cultivating the lands on lease basis. Considering the facts and the allegations against the accused, he may be granted anticipatory bail by imposing conditions. Hence, I pass following order. \r\n---argument-ends---\r\nO R D E R 1) Criminal Bail Application no. 67 of 2019 is allowed. 2) In the event of arrest of applicant Hajisaheb Mosin Inamdar he be released on pre足arrest bail, in respect of the Crime No.379/2017 registered with Satara City Police Station on his furnishing personal bond of Rs.50,000/足 with one or more surety/ies. a) Applicant shall attend the concern police station twice in a week preferably on every Monday and Thursday in between 11:00 a.m. to 1.00 p.m. till filing of supplementary charge足sheet against him. b) Applicant shall not directly or indirectly make any inducement, threat or promise to any person acquainted with the facts of the case so as to dissuade them from disclosing such facts to the court or to any Police Officer. c) Applicant shall make available himself and co足operate for interrogation by Police Officer as and when required and shall co足operate in the investigation of the present C.R. d) Applicant shall not tamper any of the documents connected to the present C.R. under investigation. e) Applicant shall also produce the documents called by the I.O. during the course of his investigation. \r\n---order-ends---\r\n(B.S.Wavre) Place : Satara Addl. Sessions Judge Date : 21st February, 2019. Satara"
}