{
  "header": "ORDER BELOW EXH.1 IN CRIMINAL BAIL APPLICATION No. 13 of 2019 (Sulochana Manohar Lolar Vs. State of Maharashtra) CNR : MHST01­000149­2019",
  "background": {
    "text": "1) This is the bail application under Sec. 439 of Code of Criminal Procedure is filed by applicant­accused in C.R.No. 591 of 2018 registered with Shahupuri Police Station.",
    "legalReferences": [
      {
        "refNumber": 1,
        "legalActFound": {
          "actNameMatched": "Code of Criminal Procedure",
          "sectionsMatched": "439",
          "stringMatched": "under Sec. 439 of Code of Criminal Procedure",
          "legalAct": {
            "actId": 1,
            "actName": "Code of Criminal Procedure",
            "actShortNameList": "CrPC,Cr.PC,Cr. P. C.,Cr.P.C.,Criminal Procedure Code",
            "actYear": "1973",
            "minSectionNumber": "1",
            "maxSectionNumber": "484"
          }
        },
        "legalRefAcceptRejectDecision": "ACCEPT_SUGGESTION",
        "legalRefAcceptRejectDecisionAnnotations": [
          {
            "username": "a1",
            "legalRefAcceptRejectDecision": "ACCEPT_SUGGESTION"
          },
          {
            "username": "a2",
            "legalRefAcceptRejectDecision": "ACCEPT_SUGGESTION"
          },
          {
            "username": "a3",
            "legalRefAcceptRejectDecision": "ACCEPT_SUGGESTION"
          }
        ]
      }
    ]
  },
  "arguments": [
    {
      "argumentNumber": 1,
      "text": "2) Accused was arrested in above mentioned crime on 13.12.2018. The said crime is registered in respect of the offence punishable under Section 370(1)(2) of Indian Penal Code and u/Sec. 3, 4, 5, 7 of Immoral Trafficking (Prevention) Act. Accused at present is in Magisterial Custody. It is stated that, the applicant is innocent, she is arrested on suspicion, applicant is ready to furnish bail and also abide the conditions if imposed.",
      "argumentBy": "APPLICANT",
      "argumentByAnnotations": [
        {
          "username": "a1",
          "argumentBy": "APPLICANT"
        },
        {
          "username": "a2",
          "argumentBy": "APPLICANT"
        },
        {
          "username": "a3",
          "argumentBy": "APPLICANT"
        }
      ],
      "argumentSentences": [
        {
          "sentenceNumber": 1,
          "text": "2) Accused was arrested in above mentioned crime on 13.12.2018.",
          "argumentSentenceType": "PREMISE",
          "argumentSentenceTypeAnnotations": [
            {
              "username": "a1",
              "argumentSentenceType": "PREMISE"
            },
            {
              "username": "a2",
              "argumentSentenceType": "PREMISE"
            },
            {
              "username": "a3",
              "argumentSentenceType": "PREMISE"
            }
          ]
        },
        {
          "sentenceNumber": 2,
          "text": "The said crime is registered in respect of the offence punishable under Section 370(1)(2) of Indian Penal Code and u/Sec. 3, 4, 5, 7 of Immoral Trafficking (Prevention) Act.",
          "argumentSentenceType": "PREMISE",
          "argumentSentenceTypeAnnotations": [
            {
              "username": "a1",
              "argumentSentenceType": "PREMISE"
            },
            {
              "username": "a2",
              "argumentSentenceType": "PREMISE"
            },
            {
              "username": "a3",
              "argumentSentenceType": "PREMISE"
            }
          ]
        },
        {
          "sentenceNumber": 3,
          "text": "Accused at present is in Magisterial Custody.",
          "argumentSentenceType": "PREMISE",
          "argumentSentenceTypeAnnotations": [
            {
              "username": "a1",
              "argumentSentenceType": "PREMISE"
            },
            {
              "username": "a2",
              "argumentSentenceType": "PREMISE"
            },
            {
              "username": "a3",
              "argumentSentenceType": "PREMISE"
            }
          ]
        },
        {
          "sentenceNumber": 4,
          "text": "It is stated that, the applicant is innocent, she is arrested on suspicion, applicant is ready to furnish bail and also abide the conditions if imposed.",
          "argumentSentenceType": "PREMISE",
          "argumentSentenceTypeAnnotations": [
            {
              "username": "a1",
              "argumentSentenceType": "PREMISE"
            },
            {
              "username": "a2",
              "argumentSentenceType": "PREMISE"
            },
            {
              "username": "a3",
              "argumentSentenceType": "PREMISE"
            }
          ]
        }
      ]
    },
    {
      "argumentNumber": 2,
      "text": "3) In spite of sufficient opportunity, prosecution failed to file say.",
      "argumentBy": "APPLICANT",
      "argumentByAnnotations": [
        {
          "username": "a1",
          "argumentBy": "APPLICANT"
        },
        {
          "username": "a2",
          "argumentBy": "APPLICANT"
        },
        {
          "username": "a3",
          "argumentBy": "APPLICANT"
        }
      ],
      "argumentSentences": [
        {
          "sentenceNumber": 1,
          "text": "3) In spite of sufficient opportunity, prosecution failed to file say.",
          "argumentSentenceType": "PREMISE",
          "argumentSentenceTypeAnnotations": [
            {
              "username": "a1",
              "argumentSentenceType": "PREMISE"
            },
            {
              "username": "a2",
              "argumentSentenceType": "PREMISE"
            },
            {
              "username": "a3",
              "argumentSentenceType": "PREMISE"
            }
          ]
        }
      ]
    },
    {
      "argumentNumber": 3,
      "text": "4) Heard learned Advocate for the applicant­accused. It is submitted that, applicant is poor and innocent, she is permanent resident of Satara, if she is released on bail, she will not abscond and is ever ready to assist the investigation agency.",
      "argumentBy": "JUDGE",
      "argumentByAnnotations": [
        {
          "username": "a1",
          "argumentBy": "APPLICANT"
        },
        {
          "username": "a2",
          "argumentBy": "JUDGE"
        },
        {
          "username": "a3",
          "argumentBy": "JUDGE"
        }
      ],
      "argumentSentences": [
        {
          "sentenceNumber": 1,
          "text": "4) Heard learned Advocate for the applicant­accused.",
          "argumentSentenceType": "PREMISE",
          "argumentSentenceTypeAnnotations": [
            {
              "username": "a1",
              "argumentSentenceType": "PREMISE"
            },
            {
              "username": "a2",
              "argumentSentenceType": "PREMISE"
            },
            {
              "username": "a3",
              "argumentSentenceType": "PREMISE"
            }
          ]
        },
        {
          "sentenceNumber": 2,
          "text": "It is submitted that, applicant is poor and innocent, she is permanent resident of Satara, if she is released on bail, she will not abscond and is ever ready to assist the investigation agency.",
          "argumentSentenceType": "PREMISE",
          "argumentSentenceTypeAnnotations": [
            {
              "username": "a1",
              "argumentSentenceType": "PREMISE"
            },
            {
              "username": "a2",
              "argumentSentenceType": "PREMISE"
            },
            {
              "username": "a3",
              "argumentSentenceType": "PREMISE"
            }
          ]
        }
      ]
    },
    {
      "argumentNumber": 4,
      "text": "6) Considering the submissions and papers, I have to mention that, accused is in jail since 16.12.2018, despite chances, prosecution failed to file say. Considering nature of the offence, custody of accused is not required for any purpose including the purpose of investigation and accused may be granted bail. Hence, I pass following order.",
      "argumentBy": "JUDGE",
      "argumentByAnnotations": [
        {
          "username": "a1",
          "argumentBy": "JUDGE"
        },
        {
          "username": "a2",
          "argumentBy": "JUDGE"
        },
        {
          "username": "a3",
          "argumentBy": "JUDGE"
        }
      ],
      "argumentSentences": [
        {
          "sentenceNumber": 1,
          "text": "6) Considering the submissions and papers, I have to mention that, accused is in jail since 16.12.2018, despite chances, prosecution failed to file say.",
          "argumentSentenceType": "PREMISE",
          "argumentSentenceTypeAnnotations": [
            {
              "username": "a1",
              "argumentSentenceType": "PREMISE"
            },
            {
              "username": "a2",
              "argumentSentenceType": "PREMISE"
            },
            {
              "username": "a3",
              "argumentSentenceType": "PREMISE"
            }
          ]
        },
        {
          "sentenceNumber": 2,
          "text": "Considering nature of the offence, custody of accused is not required for any purpose including the purpose of investigation and accused may be granted bail.",
          "argumentSentenceType": "PREMISE",
          "argumentSentenceTypeAnnotations": [
            {
              "username": "a1",
              "argumentSentenceType": "PREMISE"
            },
            {
              "username": "a2",
              "argumentSentenceType": "PREMISE"
            },
            {
              "username": "a3",
              "argumentSentenceType": "PREMISE"
            }
          ]
        },
        {
          "sentenceNumber": 3,
          "text": "Hence, I pass following order.",
          "argumentSentenceType": "CONCLUSION",
          "argumentSentenceTypeAnnotations": [
            {
              "username": "a1",
              "argumentSentenceType": "CONCLUSION"
            },
            {
              "username": "a2",
              "argumentSentenceType": "CONCLUSION"
            },
            {
              "username": "a3",
              "argumentSentenceType": "CONCLUSION"
            }
          ]
        }
      ]
    }
  ],
  "order": {
    "text": "O R D E R 1) Criminal Bail Application no. 13 of 2019, is allowed. 2) Applicant­accused Sulochana Manohar Lohar be released on bail on her furnishing P.R.Bond of Rs.15,000/­ (Rs. Fifteen Thousand) with surety of like amount with following conditions. a) Accused to attend Shahupuri Police Station once in a week i.e. on every Monday in between 11.00 a.m. to 1.00 p.m. till filing of charge­sheet. b) Accused shall not directly or indirectly make any inducement, threat or promise to any person acquainted with the facts of the case so as to dissuade him from disclosing such facts to the court or to any Police Officer. c) Any default of above conditions shall render the bail to be cancelled automatically. d) Compliance before lower Court.",
    "orderType": "ACCEPTED",
    "orderTypeAnnotations": [
      {
        "username": "a1",
        "orderType": "ACCEPTED"
      },
      {
        "username": "a2",
        "orderType": "ACCEPTED"
      },
      {
        "username": "a3",
        "orderType": "ACCEPTED"
      }
    ],
    "bondAmount": "15000",
    "bondAmountAnnotations": [
      {
        "username": "a1",
        "bondAmount": "15000"
      },
      {
        "username": "a2",
        "bondAmount": "15000"
      },
      {
        "username": "a3",
        "bondAmount": "15000"
      }
    ],
    "attendPoliceStationRecurrence": "WEEKLY",
    "attendPoliceStationRecurrenceAnnotations": [
      {
        "username": "a1",
        "attendPoliceStationRecurrence": "WEEKLY"
      },
      {
        "username": "a2",
        "attendPoliceStationRecurrence": "WEEKLY"
      },
      {
        "username": "a3",
        "attendPoliceStationRecurrence": "WEEKLY"
      }
    ],
    "attendPoliceStationFrequency": "1",
    "attendPoliceStationFrequencyAnnotations": [
      {
        "username": "a1",
        "attendPoliceStationFrequency": "1"
      },
      {
        "username": "a2",
        "attendPoliceStationFrequency": "1"
      },
      {
        "username": "a3",
        "attendPoliceStationFrequency": "1"
      }
    ]
  },
  "footer": "(B.S.Wavre) Place : Satara Addl. Sessions Judge Date :6th February, 2019. Satara",
  "annotationProcessingStage": "STAGE2",
  "annotationProcessingStageAnnotations": [
    {
      "username": "a1",
      "annotationProcessingStage": "STAGE2"
    },
    {
      "username": "a2",
      "annotationProcessingStage": "STAGE2"
    },
    {
      "username": "a3",
      "annotationProcessingStage": "STAGE2"
    }
  ],
  "processedText": "ORDER BELOW EXH.1 IN CRIMINAL BAIL APPLICATION No. 13 of 2019 (Sulochana Manohar Lolar Vs. State of Maharashtra) CNR : MHST01­000149­2019 \r\n---header-ends---\r\n1) This is the bail application under Sec. 439 of Code of Criminal Procedure is filed by applicant­accused in C.R.No. 591 of 2018 registered with Shahupuri Police Station. \r\n---background-ends---\r\n2) Accused was arrested in above mentioned crime on 13.12.2018. The said crime is registered in respect of the offence punishable under Section 370(1)(2) of Indian Penal Code and u/Sec. 3, 4, 5, 7 of Immoral Trafficking (Prevention) Act. Accused at present is in Magisterial Custody. It is stated that, the applicant is innocent, she is arrested on suspicion, applicant is ready to furnish bail and also abide the conditions if imposed. \r\n---argument-ends---\r\n3) In spite of sufficient opportunity, prosecution failed to file say. \r\n---argument-ends---\r\n4) Heard learned Advocate for the applicant­accused. It is submitted that, applicant is poor and innocent, she is permanent resident of Satara, if she is released on bail, she will not abscond and is ever ready to assist the investigation agency. \r\n---argument-ends---\r\n6) Considering the submissions and papers, I have to mention that, accused is in jail since 16.12.2018, despite chances, prosecution failed to file say. Considering nature of the offence, custody of accused is not required for any purpose including the purpose of investigation and accused may be granted bail. Hence, I pass following order. \r\n---argument-ends---\r\nO R D E R 1) Criminal Bail Application no. 13 of 2019, is allowed. 2) Applicant­accused Sulochana Manohar Lohar be released on bail on her furnishing P.R.Bond of Rs.15,000/­ (Rs. Fifteen Thousand) with surety of like amount with following conditions. a) Accused to attend Shahupuri Police Station once in a week i.e. on every Monday in between 11.00 a.m. to 1.00 p.m. till filing of charge­sheet. b) Accused shall not directly or indirectly make any inducement, threat or promise to any person acquainted with the facts of the case so as to dissuade him from disclosing such facts to the court or to any Police Officer. c) Any default of above conditions shall render the bail to be cancelled automatically. d) Compliance before lower Court. \r\n---order-ends---\r\n(B.S.Wavre) Place : Satara Addl. Sessions Judge Date :6th February, 2019. Satara"
}